{
  "requestId": "a1b2c3d4-e5f6-7890-abcd-ef1234567890",
  "timestamp": "2025-03-15T14:30:00Z",
  "action": "example-value",
  "result": "SUCCESS",
  "actor": {
    "id": "a1b2c3d4-e5f6-7890-abcd-ef1234567890",
    "account": "example-value",
    "jti": "example-value",
    "userAgent": "example-value",
    "requestIp": "example-value"
  },
  "resource": {
    "type": "LOGIN",
    "vault": "example-value",
    "item": {
      "id": "a1b2c3d4-e5f6-7890-abcd-ef1234567890"
    },
    "itemVersion": 73
  }
}